anio,cancion,artista,generos_artista,popularidad,fecha_lanzamiento
2010,Solo un Momento,Vicentico,"argentine rock, latin rock, rock en español",59,2010
2010,Gnaw,Alex G,,70,2010-01-01
2010,Heaven Nor Hell,Volbeat,"rock, metal",60,2010-09-10
2010,Paisaje,Vicentico,"argentine rock, latin rock, rock en español",62,2010
2010,Labios Compartidos,Maná,"rock en español, latin rock, mexican rock, latin pop",51,2010-03-16
2010,Ella,Tan Bionica,argentine rock,63,2010-01-01
2010,Shoot to Thrill,AC/DC,"rock, hard rock, classic rock, rock and roll",57,2010-04-29
2010,Beat the Devil's Tattoo,Black Rebel Motorcycle Club,"southern gothic, garage rock, blues rock",56,2010-03-07
2010,2 Caras 2 Corazones,Caramelos De Cianuro,"latin rock, rock en español",53,2010
2010,Fallen,Volbeat,"rock, metal",63,2010-09-10
2010,Beauty School,Deftones,"nu metal, alternative metal, rap metal, shoegaze, rock",69,2010-04-30
2010,Mariposa Traicionera,Maná,"rock en español, latin rock, mexican rock, latin pop",58,2010-03-16
2010,Do Ya Wanna Taste It,Wig Wam,"glam rock, norsk rock, glam metal",67,2010-01-22
2010,Agarra Mi Mano,Sean Paul,dancehall,60,2010-02-12
2010,Risk,Deftones,"nu metal, alternative metal, rap metal, shoegaze, rock",73,2010-04-30
2010,Palaces of Montezuma,Grinderman,garage rock,52,2010-01-01
2010,Oh Lord,Foxy Shazam,glam rock,71,2010-04-12
2010,Diamond Eyes,Deftones,"nu metal, alternative metal, rap metal, shoegaze, rock",69,2010-04-30
2010,Verano,Caramelos De Cianuro,"latin rock, rock en español",53,2010
2010,Ángel con campera,No Te Va Gustar,"argentine rock, murga, latin rock, rock en español, latin alternative",30,2010-11-02
2010,Back In Black,AC/DC,"rock, hard rock, classic rock, rock and roll",59,2010-04-29
2010,Loca,Tan Bionica,argentine rock,66,2010-01-01
2010,Comin' Through,The War On Drugs,indie rock,57,2010-10-26
2010,Not Strong Enough,Apocalyptica,symphonic metal,68,2010-08-20
2010,Sextape,Deftones,"nu metal, alternative metal, rap metal, shoegaze, rock",82,2010-04-30
2010,Contra la pared,Desakato,ska punk,33,2010-02-01
2010,Doctor My Eyes - 1997 Remaster,Jackson Browne,"yacht rock, folk rock, soft rock, singer-songwriter",67,2010-04-05
2010,Rubia Sol Morena Luna,Caramelos De Cianuro,"latin rock, rock en español",60,2010
2010,It's My Life,Bon Jovi,"glam metal, rock",57,2010-11-09
2010,Al Vacio,No Te Va Gustar,"argentine rock, murga, latin rock, rock en español, latin alternative",32,2010-11-02
2010,Personalmente,Las Pelotas,"argentine rock, rock en español",66,2010-11-09
2010,Adiós Amor,Caramelos De Cianuro,"latin rock, rock en español",50,2010
2010,Blues del pescador,Celtas Cortos,"celtic rock, celtic",47,2010-08-31
2010,Beautiful,Tan Bionica,argentine rock,65,2010-01-01
2010,It's Time,Bobby Alu,surf rock,56,2010-10-01
2010,The Lost Art Of Keeping A Secret,Queens of the Stone Age,"stoner rock, alternative rock",61,2010-01-01
2010,Caribbean Queen (No More Love On the Run),Billy Ocean,yacht rock,75,2010-04-26
2010,So Far Away,Avenged Sevenfold,"metal, alternative metal",72,2010-07-25
2010,La Casa,Caramelos De Cianuro,"latin rock, rock en español",59,2010
2010,Nada,Zoé,"rock en español, mexican rock, mexican indie, latin alternative, latin indie, latin rock",71,2010-01-01
2010,Ready to Start,Arcade Fire,"indie rock, baroque pop",59,2010-07-01
2010,Sprawl II (Mountains Beyond Mountains),Arcade Fire,"indie rock, baroque pop",59,2010-07-01
2010,The Suburbs,Arcade Fire,"indie rock, baroque pop",65,2010-07-01
2010,Frente a frente (feat. Tulsa),Bunbury,"rock en español, latin rock, mexican rock",70,2010-02-16
2010,Suffocation,Crystal Castles,"witch house, electroclash, new rave, alternative dance",73,2010-01-01
2010,De todo el mundo,Bunbury,"rock en español, latin rock, mexican rock",62,2010-02-16
2010,Obsesionario en La Mayor,Tan Bionica,argentine rock,71,2010-01-01
2010,Down with the Sickness,Disturbed,"metal, nu metal, alternative metal, rap metal, hard rock",64,2010-03-22
2010,Thunderstruck,AC/DC,"rock, hard rock, classic rock, rock and roll",64,2010-04-29
2010,Lucha de gigantes,Celtas Cortos,"celtic rock, celtic",43,2010-08-31
2010,Victim,Avenged Sevenfold,"metal, alternative metal",59,2010-07-25
2010,Under Pressure - Live,David Bowie,"glam rock, art rock",47,2010-01-25
2010,Why Won't You Make Up Your Mind?,Tame Impala,"neo-psychedelic, indie",60,2010-05-21
2010,Come Undone,My Darkest Days,,61,2010-01-01
2010,La Suerte Esta Echada,Tan Bionica,argentine rock,57,2010-01-01
2010,Amor Depredador,The Mills,"rock en español, colombian pop, latin rock",54,2010-09-01
2010,Whole Lotta Love (feat. Chris Cornell),Santana,,50,2010-09-20
2010,Somebody's Baby,Jackson Browne,"yacht rock, folk rock, soft rock, singer-songwriter",64,2010-04-05
2010,Rezo por Vos (En Vivo Estadio Vélez Sarsfield) (feat. Charly García),Luis Alberto Spinetta,"argentine rock, latin rock, rock en español",54,2010-12-02
2010,Té para Tres (En Vivo Estadio Vélez Sarsfield) (feat. Gustavo Cerati),Luis Alberto Spinetta,"argentine rock, latin rock, rock en español",52,2010-12-02
2010,Leave,Whirr,"shoegaze, slowcore, dream pop",63,2010-05-30
2010,Suna,Mar de Copas,rock en español,54,2010-01-01
2010,Bajan (En Vivo Estadio Vélez Sarsfield) (feat. Gustavo Cerati),Luis Alberto Spinetta,"argentine rock, latin rock, rock en español",55,2010-12-02
2010,The Good Die Young,Scorpions,"hard rock, glam metal, rock",44,2010-03-22
2010,Hyperventilation,RADWIMPS,"anime, j-pop, j-rock",57,2010-06-30
2010,Raised on Rock,Scorpions,"hard rock, glam metal, rock",43,2010-03-22
2010,From The Clouds,Jack Johnson,surf rock,52,2010-01-01
2010,T.N.T.,AC/DC,"rock, hard rock, classic rock, rock and roll",52,2010-04-29
2010,Visita,Enjambre,"mexican indie, rock en español, mexican rock, latin indie, latin rock",70,2010-01-01
2010,Dulce Soledad,Enjambre,"mexican indie, rock en español, mexican rock, latin indie, latin rock",71,2010-01-01
2010,The Mirror And The Ripper,Volbeat,"rock, metal",52,2010-09-10
2010,Hesitate,Stone Sour,"post-grunge, alternative metal, nu metal",57,2010-09-03
2010,Dust in the Wind,Kansas,"classic rock, progressive rock, aor",39,2010
2010,976-EVIL,Deftones,"nu metal, alternative metal, rap metal, shoegaze, rock",65,2010-04-30
2010,Un Soplo Mas,Exceso,,27,2010-12-08
2010,Estrógeno,Caramelos De Cianuro,"latin rock, rock en español",44,2010
2010,The Ecstacy Once Told,The Dolly Rocker Movement,"neo-psychedelic, psychedelic rock, space rock, stoner rock",55,2010-02-22
2010,Los habitantes,Bunbury,"rock en español, latin rock, mexican rock",46,2010-02-16
2010,Feel Good Hit Of The Summer,Queens of the Stone Age,"stoner rock, alternative rock",50,2010-01-01
2010,This Is Love This Is Life,Bon Jovi,"glam metal, rock",41,2010-01-01
2010,Solitude Is Bliss,Tame Impala,"neo-psychedelic, indie",60,2010-05-21
2010,Ready to Start,Arcade Fire,"indie rock, baroque pop",50,2010-08-02
2010,El marinero borracho - The Drunken Sailor,Celtas Cortos,"celtic rock, celtic",26,2010-08-31
2010,"""Heroes"" - Live",David Bowie,"glam rock, art rock",47,2010-01-25
2010,The Suburbs,Arcade Fire,"indie rock, baroque pop",56,2010-08-02
2010,Bang A Gong (Get It On) (Electric Version),T. Rex,"glam rock, proto-punk",48,2010-07-01
2010,Alter Ego,Tame Impala,"neo-psychedelic, indie",62,2010-05-21
2010,You And Your Heart,Jack Johnson,surf rock,54,2010-01-01
2010,It Is Not Meant To Be,Tame Impala,"neo-psychedelic, indie",59,2010-05-21
2010,Wherever you are,ONE OK ROCK,"j-rock, j-pop",63,2010-06-09
2010,Africa,TOTO,"yacht rock, soft rock",49,2010-03-01
2010,No Decoder,Yogi Lang,"progressive rock, art rock",53,2010-11-05
2010,Lo que más te gustó de mí,Bunbury,"rock en español, latin rock, mexican rock",49,2010-02-16
2010,Highway to Hell,AC/DC,"rock, hard rock, classic rock, rock and roll",52,2010-04-29
2010,"Me voy, me voy",Gerardo Morán,"chicha, electrocumbia, cumbia",46,2010-05-02
2010,I Ran (So Far Away) - Single Edit,A Flock Of Seagulls,"new wave, synthpop",53,2010-03-01
2010,Carry on Wayward Son,Kansas,"classic rock, progressive rock, aor",60,2010
2010,Traguito Bueno,Gerardo Morán,"chicha, electrocumbia, cumbia",46,2010-05-16
2010,Say You'll Haunt Me,Stone Sour,"post-grunge, alternative metal, nu metal",63,2010-09-03
2010,Still Worth Fighting For,My Darkest Days,,59,2010-09-21
2010,Fox On The Run,Sweet,glam rock,44,2010-05-01
2010,La Bomba Loca,Gustavo Cordera,argentine rock,51,2010-08-18
2010,No Voy a Llorar,Gerardo Morán,"chicha, electrocumbia, cumbia",39,2010-05-16
2010,Fiction,Avenged Sevenfold,"metal, alternative metal",57,2010-07-25
2010,Quisiera Saber (with Natalia Lafourcade),Los Daniels,"rock en español, mexican rock, mexican indie",61,2010-11-09
2010,Love Fade,Tamaryn,"shoegaze, dream pop",51,2010-09-21
2010,HEKIREKI - 2010,LAST ALLIANCE,"j-rock, anime, visual kei",47,2010-10-27
2010,Garbage Truck,Sex Bob-Omb,,57,2010-01-01
2010,Prince,Deftones,"nu metal, alternative metal, rap metal, shoegaze, rock",57,2010-04-30
2010,Infierno VIP,Caramelos De Cianuro,"latin rock, rock en español",39,2010
2010,Pastillitas del Olvido,Tan Bionica,argentine rock,57,2010-01-01
2010,We Are One,12 Stones,"christian rock, post-grunge, christian alternative rock",50,2010-01-01
2010,Porn Star Dancing,My Darkest Days,,69,2010-01-01
2010,Eye In the Sky,The Alan Parsons Project,"progressive rock, classic rock",41,2010-03-01
2010,Lucidity,Tame Impala,"neo-psychedelic, indie",54,2010-05-21
2010,This Place Is Death,Deftones,"nu metal, alternative metal, rap metal, shoegaze, rock",59,2010-04-30
2010,Time Bomb,Iration,"reggae rock, reggae, roots reggae",51,2010
2010,Brotherhood Of Man,Motörhead,"heavy metal, metal, speed metal, hard rock, rock",43,2010-11-08
2010,We Used to Wait,Arcade Fire,"indie rock, baroque pop",47,2010-07-01
2010,Little Drops Of Heaven,Pretty Maids,"aor, arena rock, hard rock, glam metal, heavy metal, power metal",45,2010-05-14
2010,Auto Pilot,Queens of the Stone Age,"stoner rock, alternative rock",47,2010-01-01
2010,Navy Light,Labyrinth Ear,"witch house, darkwave, cold wave",53,2010-03-08
2010,Sprawl II (Mountains Beyond Mountains),Arcade Fire,"indie rock, baroque pop",51,2010-08-02
2010,Going Back,Phil Collins,soft rock,45,2010-09-10
2010,Little Girl (feat. Julian Casablancas),Danger Mouse,,45,2010-05-03
2010,"I'll Try Anything Once - Live From Electric Lady Studios for WRXP, New York",Julian Casablancas,,46,2010-03-29
2010,Take Me for a Ride,Bad City,"glam metal, arena rock",50,2010-08-23
2010,Better Living Through Chemistry,Queens of the Stone Age,"stoner rock, alternative rock",48,2010-01-01
2010,16 Dollars,Volbeat,"rock, metal",51,2010-09-10
2010,The Regulator,Clutch,"stoner rock, stoner metal, sludge metal",51,2010
2010,You're Gonna Miss Me (2008 Remastered Original Mono LP Version),13th Floor Elevators,"psychedelic rock, acid rock, proto-punk, garage rock",48,2010
2010,No Apologies,Bon Jovi,"glam metal, rock",40,2010-01-01
2010,Ángel Con Campera,No Te Va Gustar,"argentine rock, murga, latin rock, rock en español, latin alternative",63,2010-10-01
2010,Royal,Deftones,"nu metal, alternative metal, rap metal, shoegaze, rock",58,2010-04-30
2010,In The Fade/Feel Good Hit Of The Summer (Reprise),Queens of the Stone Age,"stoner rock, alternative rock",50,2010-01-01
2010,Rocket Skates,Deftones,"nu metal, alternative metal, rap metal, shoegaze, rock",59,2010-04-30
2010,Carry On Wayward Son - Single Version,Kansas,"classic rock, progressive rock, aor",49,2010-03-01
2010,Guaracadita,Banda Show 24 de Mayo de Patate,"chicha, electrocumbia, cumbia",42,2010-09-01
2010,Evil Thoughts,Foxy Shazam,glam rock,50,2010-04-12
2010,Cero a la izquierda,No Te Va Gustar,"argentine rock, murga, latin rock, rock en español, latin alternative",23,2010-11-02
2010,Every Lie,My Darkest Days,,59,2010-01-01
2010,Eatin' Dust,Fu Manchu,"stoner rock, stoner metal, sludge metal, doom metal, space rock",48,2010-08-14
2010,Volviendo a casa,Rata Blanca,"rock en español, argentine rock, latin rock, mexican rock",28,2010-12-30
2010,"Lagrimitay, Cervecitay",Gerardo Morán,"chicha, electrocumbia, cumbia",42,2010-05-02
2010,Paper Moon,Minuano,"shibuya-kei, japanese indie, bossa nova",56,2010-04-21
2010,I Can't Hear You,The Dead Weather,"garage rock, southern gothic, blues rock, modern blues",52,2010-05-11
2010,Modern Man,Arcade Fire,"indie rock, baroque pop",48,2010-07-01
2010,Kanzen kankaku Dreamer,ONE OK ROCK,"j-rock, j-pop",56,2010-06-09
2010,Tonight the World Dies,Avenged Sevenfold,"metal, alternative metal",57,2010-07-25
2010,Bomba Ecuatoriana,Banda Show 24 de Mayo de Patate,"chicha, electrocumbia, cumbia",43,2010-09-01
2010,Beauty School,Deftones,"nu metal, alternative metal, rap metal, shoegaze, rock",58,2010-04-30
2010,Rock Me Amadeus,Falco,neue deutsche welle,49,2010-10-22
2010,Parting Time,Rockstar,"opm, pinoy rock, pinoy alternative, p-pop",65,2010
2010,Diamond Eyes,Deftones,"nu metal, alternative metal, rap metal, shoegaze, rock",57,2010-04-30
2010,Memorias del Olvido,No Te Va Gustar,"argentine rock, murga, latin rock, rock en español, latin alternative",52,2010-10-01
2010,Too Young to Burn,Sonny & The Sunsets,,48,2010
2010,Threshold,Sex Bob-Omb,,55,2010-01-01
2010,Solo voy,La 25,argentine rock,53,2010-12-28
2010,Suffocation,Crystal Castles,"witch house, electroclash, new rave, alternative dance",57,2010-01-01
2010,We Are Sex Bob-Omb,Sex Bob-Omb,,53,2010-01-01
2010,Madrugada,Enjambre,"mexican indie, rock en español, mexican rock, latin indie, latin rock",62,2010-01-01
2010,Quién Fuera,Los Bunkers,"latin rock, rock en español, latin alternative",60,2010-01-01
2010,Hocus Pocus,Focus,"progressive rock, nederpop, art rock",50,2010-05-31
2010,Ya No Te Quiero,Vicentico,"argentine rock, latin rock, rock en español",51,2010
2010,Love-Hate-Sex-Pain,Godsmack,"alternative metal, nu metal, hard rock, rap metal, metal",61,2010-01-01
2010,We're not alone,coldrain,"j-rock, metalcore, anime",46,2010-06-23
2010,To Get Back To You,Nelson,"glam metal, aor, glam rock, arena rock",49,2010-11-08
2010,No Plan B,Manafest,"christian rock, christian hip hop, christian alternative rock, rap rock",48,2010-03-30
2010,Black Betty,Ram Jam,southern rock,39,2010-04-30
2010,Imperfect,Stone Sour,"post-grunge, alternative metal, nu metal",51,2010-09-03
2010,La Duda,Enjambre,"mexican indie, rock en español, mexican rock, latin indie, latin rock",64,2010-01-01
2010,On The Run,The Jompson Brothers,"southern rock, country rock, outlaw country, country blues",57,2010-11-30
2010,Love Comes And Goes,Xavier Rudd,,42,2010-04-19
2010,Creeping in My Soul,Cryoshell,,50,2010-06-07
2010,Arde la ciudad,Mancha De Rolando,argentine rock,47,2010-12-29
2010,Sting in the Tail,Scorpions,"hard rock, glam metal, rock",34,2010-03-22
2010,Ella me dijo que no,Bunbury,"rock en español, latin rock, mexican rock",41,2010-02-16
2010,The More Things Change,Bon Jovi,"glam metal, rock",38,2010-11-09
2010,The Space In Between,How To Destroy Angels,"industrial rock, industrial, industrial metal",50,2010-05-26
2010,Erase My Scars,Evans Blue,"post-grunge, alternative metal",55,2010-07-27
2010,If You Want Blood (You've Got It),AC/DC,"rock, hard rock, classic rock, rock and roll",47,2010-04-29
2010,Speaking in Tongues (feat. David Byrne),Arcade Fire,"indie rock, baroque pop",42,2010-07-01
2010,Have I Told You Lately - 2008 Remaster,Rod Stewart,soft rock,43,2010
2010,Pasajeros,Las Pelotas,"argentine rock, rock en español",48,2010-11-09
2010,You’ve Got A Friend - Live At The Troubadour / 2007,Carole King,"singer-songwriter, folk rock",40,2010-01-01
2010,No Matter What,Papa Roach,"nu metal, rap metal, alternative metal, rap rock, rock",50,2010-08-31
2010,Oh Lord,Foxy Shazam,glam rock,37,2010-09-24
2010,CMND/CTRL,Deftones,"nu metal, alternative metal, rap metal, shoegaze, rock",56,2010-04-30
2010,Can't Forget You,My Darkest Days,,54,2010-01-01
2010,Rock Me Amadeus,Falco,neue deutsche welle,44,2010-10-22
2010,Demolición,Los Saicos,"proto-punk, garage rock",39,2010-03-15
2010,Desire Be Desire Go,Tame Impala,"neo-psychedelic, indie",53,2010-05-21
2010,Sleep Is for the Weak,The Dreadnoughts,"sea shanties, celtic punk, celtic rock, folk punk, polka, celtic",51,2010-09-28
2010,You Give Love A Bad Name,Bon Jovi,"glam metal, rock",46,2010-11-09
2010,Un Poco Solo,Caramelos De Cianuro,"latin rock, rock en español",39,2010
2010,Umbrella,The Baseballs,"rockabilly, dansband, boogie-woogie",31,2010-02-08
2010,Suburban War,Arcade Fire,"indie rock, baroque pop",44,2010-07-01
2010,La Celula Que Explota,Caifanes,"rock en español, mexican rock, latin rock, latin alternative",41,2010-09-21
2010,Deep Blue,Arcade Fire,"indie rock, baroque pop",43,2010-07-01
2010,Lobby,Caramelos De Cianuro,"latin rock, rock en español",39,2010
2010,No Digas Lo Siento,Don Tetto,"colombian pop, rock en español, latin rock",48,2010-07-06
2010,Romance Is Boring (2020 Remaster),Los Campesinos!,,48,2010-01-26
2010,Cobarde,Enjambre,"mexican indie, rock en español, mexican rock, latin indie, latin rock",61,2010-01-01
2010,Mi Error,Don Tetto,"colombian pop, rock en español, latin rock",48,2010-07-06
2010,Excuses,The Morning Benders,indie rock,43,2010-06-28
2010,Fix Me,10 Years,"post-grunge, alternative metal",62,2010-01-01
2010,This Ole House,Shakin' Stevens,"christmas, rockabilly",39,2010-03-01
2010,Frente a frente,Bunbury,"rock en español, latin rock, mexican rock",37,2010-01-15
2010,Viento,Vicentico,"argentine rock, latin rock, rock en español",46,2010
2010,El boxeador,Bunbury,"rock en español, latin rock, mexican rock",36,2010-02-16
2010,Sweetest Kill,Broken Social Scene,"baroque pop, indie rock, indie",37,2010-04-30
2010,Can't Reach You,Yogi Lang,"progressive rock, art rock",42,2010-11-05
2010,Resulta Imposible,Las Pastillas del Abuelo,argentine rock,48,2010-01-01
2010,Vino Mariani,Indio Solari,argentine rock,49,2010-06-12
2010,Wonderful Life,Alter Bridge,"post-grunge, alternative metal, hard rock",43,2010-10-08
2010,Wanna-be Angel,Foxy Shazam,glam rock,45,2010-04-12
2010,Give Me One Reason,Lee Ritenour's 6 String Theory,"blues, jazz fusion, blues rock",41,2010-01-01
2010,Monsters In The Parasol,Queens of the Stone Age,"stoner rock, alternative rock",44,2010-01-01
2010,Truth,Molly Nilsson,"cold wave, darkwave, synthpop",40,2010-06-07
2010,Rock 'N' Roll Damnation,AC/DC,"rock, hard rock, classic rock, rock and roll",43,2010-04-29
2010,Expectation,Tame Impala,"neo-psychedelic, indie",52,2010-05-21
2010,All Out of Love,Air Supply,soft rock,41,2010-03-01
2010,"I'm Gonna Live Till I Die - Recorded Live at The Triple Door, Seattle, June 23, 2009",Rodríguez,"folk rock, folk",35,2010-04-17
2010,Dance Like Nobody's Watching,Donavon Frankenreiter,surf rock,43,2010-10-04
2010,Mi único Amor,Gerardo Morán,"chicha, electrocumbia, cumbia",36,2010-05-02
2010,Song Of Yesterday,Black Country Communion,"blues rock, modern blues, hard rock",42,2010-09-21
2010,Promise (feat. Chris Cornell),Slash,hard rock,37,2010-04-02
2010,Insoportablemente cruel (feat. Calle 13 & Jerry González),Andrés Calamaro,"argentine rock, rock en español, latin rock",37,2010-05-18
2010,After All This Time,The Beautiful Girls,surf rock,41,2010-05-25
2010,Mongoose,Fu Manchu,"stoner rock, stoner metal, sludge metal, doom metal, space rock",42,2010-08-14
2010,Celosa,Angel Guaraca,"chicha, electrocumbia",36,2010-07-16
2010,Cero a la Izquierda,No Te Va Gustar,"argentine rock, murga, latin rock, rock en español, latin alternative",53,2010-10-01
2010,Amapola del 66,Divididos,"argentine rock, rock en español, latin rock",48,2010
2010,Don't Look Back in Anger,Oasis,"britpop, madchester",49,2010-06-14
2010,Mahal Pa Rin Kita,Rockstar,"opm, pinoy rock, pinoy alternative, p-pop",64,2010
2010,Quiéreme,Byron Solis,"chicha, electrocumbia",35,2010-07-16
2010,Little Wing (feat. Joe Cocker),Santana,,41,2010-09-20
2010,Yo No Quiero Más Calor,Caramelos De Cianuro,"latin rock, rock en español",36,2010
2010,Es hora de hablar,Bunbury,"rock en español, latin rock, mexican rock",37,2010-02-16
2010,Campanas en la noche,Los Tipitos,argentine rock,47,2010-12-06
2010,"Have Blues, Will Travel",Smokin' Joe Kubek & Bnois King,"blues rock, blues, modern blues",40,2010-05-25
2010,Funky Guitar Blues,Bryce Janey,"blues rock, modern blues, blues",42,2010-01-01
2010,¿Qué Podés Dar?,Las Pelotas,"argentine rock, rock en español",48,2010-11-09
2010,Morir A Tu Lado,Vicentico,"argentine rock, latin rock, rock en español",50,2010
2010,Love X Love,George Benson,"smooth jazz, yacht rock, jazz funk, soul jazz",39,2010-02-09
2010,Sugar Boo,Serani Poji,shibuya-kei,52,2010-03-03
2010,A un minuto de ti,Mikel Erentxun,"rock en español, latin rock",42,2010-12-17
2010,インフレイション II,フレネシ,"shibuya-kei, japanese indie",53,2010
2010,Las consecuencias - Asustar un poco,Bunbury,"rock en español, latin rock, mexican rock",38,2010-02-16
2010,Vital Signs - Tame Impala Cover,Midnight Juggernauts,"new rave, electroclash, alternative dance",49,2010-05-28
2010,It's My Life,Bon Jovi,"glam metal, rock",48,2010-10-29
2010,Ángel Para Un Final,Los Bunkers,"latin rock, rock en español, latin alternative",58,2010-01-01
2010,Umbrella,The Baseballs,"rockabilly, dansband, boogie-woogie",39,2010-08-27
2010,Donde vamos,Mancha De Rolando,argentine rock,39,2010-12-29
2010,Goodbye,My Darkest Days,,51,2010-01-01
2010,Black Hole Sun,Soundgarden,"grunge, post-grunge, hard rock",51,2010-09-28
2010,Whiskey and Gin,The Killigans,"celtic punk, celtic rock, celtic, folk punk",42,2010-01-16
2010,Have A Nice Day,Bon Jovi,"glam metal, rock",41,2010-11-09
2010,Rococo,Arcade Fire,"indie rock, baroque pop",42,2010-07-01
2010,Spring Lovers,Minuano,"shibuya-kei, japanese indie, bossa nova",49,2010-04-21
2010,Hustle and Cuss,The Dead Weather,"garage rock, southern gothic, blues rock, modern blues",44,2010-05-11
2010,Have a Drink on Me,AC/DC,"rock, hard rock, classic rock, rock and roll",45,2010-04-29
2010,Nobody's Home,ONE OK ROCK,"j-rock, j-pop",48,2010-06-09
2010,Good Day To Die,Godsmack,"alternative metal, nu metal, hard rock, rap metal, metal",50,2010-01-01
2010,Silencio,Los Tipitos,argentine rock,37,2010-12-06
2010,We Used to Wait,Arcade Fire,"indie rock, baroque pop",43,2010-08-02
2010,Que Estés Sonriendo,Las Pelotas,"argentine rock, rock en español",43,2010-11-09
2010,Se te nota,Los Tipitos,argentine rock,47,2010-11-11
2010,I Don't Really Mind,Tame Impala,"neo-psychedelic, indie",49,2010-05-21
2010,The Mob Goes Wild,Clutch,"stoner rock, stoner metal, sludge metal",45,2010
2010,Motor Runnin',The Jompson Brothers,"southern rock, country rock, outlaw country, country blues",49,2010-11-30
2010,Sextape,Deftones,"nu metal, alternative metal, rap metal, shoegaze, rock",52,2010-04-30
2010,Lithium,Labyrinth Ear,"witch house, darkwave, cold wave",47,2010-03-08
2010,Suicide of the 21st century,0.8Syooogeki,"visual kei, j-rock, shibuya-kei",48,2010-08-04
2010,Back from Cali (feat. Myles Kennedy),Slash,hard rock,36,2010-04-02
2010,Mujer Amante - Unplugged,Carlos Alberto,"seresta, argentine rock",35,2010
2010,I Killed Robert Johnson,The Stone Foxes,"blues rock, modern blues",42,2010-07-06
2010,By the Sword (feat. Andrew Stockdale or Wolfmother),Slash,hard rock,36,2010-04-02
2010,Doctor Alibi (feat. Lemmy Kilmister),Slash,hard rock,35,2010-04-02
2010,Petalos,Tan Bionica,argentine rock,49,2010-01-01
2010,Black Rain,Soundgarden,"grunge, post-grunge, hard rock",47,2010-09-28
2010,Surf City,Jan & Dean,"surf rock, doo-wop",46,2010-01-01
2010,Godzilla,Fu Manchu,"stoner rock, stoner metal, sludge metal, doom metal, space rock",43,2010-08-14
2010,Memories,Weezer,alternative rock,47,2010-09-14
2010,Mi Recinto,Banda Show 24 de Mayo de Patate,"chicha, electrocumbia, cumbia",34,2010-09-01
2010,"Gold - 12"" Mix",Spandau Ballet,"new wave, synthpop",33,2010-05-17
2010,Slip to the Void,Alter Bridge,"post-grunge, alternative metal, hard rock",41,2010-10-08
2010,Lobo Hombre En Paris,The Mills,"rock en español, colombian pop, latin rock",43,2010-09-01
2010,El oficio de ser mamá,Pablo Granados,rock en español,41,2010-03-01
2010,Our Darkness - Remix,Anne Clark,"new wave, ebm, darkwave, cold wave, synthpop",33,2010-01-01
2010,Liar,ONE OK ROCK,"j-rock, j-pop",45,2010-06-09
2010,To The Sea,Jack Johnson,surf rock,44,2010-01-01
2010,Sigamos Caminando,Don Tetto,"colombian pop, rock en español, latin rock",46,2010-07-06
2010,Save Me,My Darkest Days,,51,2010-01-01
2010,Dominguicidio,Tan Bionica,argentine rock,49,2010-01-01
2010,One Last Soul,Black Country Communion,"blues rock, modern blues, hard rock",39,2010-09-21
2010,Life Must Go On,Alter Bridge,"post-grunge, alternative metal, hard rock",41,2010-10-08
2010,Ghost of Days Gone By,Alter Bridge,"post-grunge, alternative metal, hard rock",42,2010-10-08
2010,Can't Fight This Feeling,REO Speedwagon,"soft rock, aor, classic rock",43,2010-03-01
2010,Acima do Sol - Ao Vivo,Skank,"brazilian rock, mpb, brazilian pop, pop rock",63,2010-09-15
2010,Wonderwall,Oasis,"britpop, madchester",60,2010-06-14
2010,Never Let Me Down Again - Live In Barcelona,Depeche Mode,"new wave, synthpop, darkwave",35,2010-11-05
2010,Falling In,Lifehouse,post-grunge,49,2010-01-01
2010,Set It On Fire,My Darkest Days,,51,2010-01-01
2010,Jibun ROCK,ONE OK ROCK,"j-rock, j-pop",45,2010-06-09
2010,Enjoy a Paranoia,The Dolly Rocker Movement,"neo-psychedelic, psychedelic rock, space rock, stoner rock",41,2010-02-22
2010,You Give Love A Bad Name,Bon Jovi,"glam metal, rock",44,2010-10-29
2010,SLY,Scorpions,"hard rock, glam metal, rock",37,2010-03-22
2010,Ballroom Blitz,Sweet,glam rock,45,2010-05-01
2010,Rocking Chair,Eric Clapton,"blues, blues rock, classic rock",33,2010-09-27
2010,Answer to Yourself,The Soft Pack,garage rock,44,2010-01-01
2010,Poison - Single Version,Alice Cooper,"glam rock, hard rock, glam metal, proto-punk, classic rock",42,2010-03-01
2010,Summer Nights,Iration,"reggae rock, reggae, roots reggae",59,2010-08-31
2010,Empty Room,Arcade Fire,"indie rock, baroque pop",39,2010-07-01
2010,Blue Blood Blues,The Dead Weather,"garage rock, southern gothic, blues rock, modern blues",43,2010-05-11
